A1: 39638
A2: CHANGE ORDER SUMMARY
A4: Fellowship | B4: Amount | C4: Reductions | E4: Description
A5: Original Bid | B5: 289155.39
A6: CO # 1 Increase for floors & tile | B6: 4183.04
A7: CO # 2 Credit for sprinklers | B7: -3500
A8: CO # 3 Plumbing design/build | B8: 735
A9: CO # 4 Corrections, upsize gas | B9: 2895.2 | C9: 1878.8 | E9: Bollinger item - J&S mistake
A10: CO # 5 Credit for kitchen millwork | B10: -1935
A11: CO # 6 Increase for VCT tile patterns | B11: 1430
A12: CO # 7 Reimbursement for permits | B12: 427.93
A13: CO # 8 Security system installation | B13: 3581.6
A14: CO # 9 Electrical panel | B14: 3300
A15: CO # 10 Supply and install (10) Exit signs | B15: 2365 | C15: 1000 | E15: Partial credit for external doors
A16: CO # 11 Change to hallway lighting | B16: 503.66 | E16: Materials for cans; other lights delivered
A17: CO # 12 Concrete floor finish upgrade | B17: 1500.4
A18: CO # 13 Credit for VCT flooring | B18: 1430
A19: CO # 14 Decorative tile for rest rooms | B19: 440
A20: CO # 15 Carpeting for stairs (front and back) | B20: =2992+2990 -> 5982
A21: CO # 16 Installation of kitchen appliances | B21: 2530
A22: CO # 17 Rear entrance walls, electrical, lighting, sprinklers | B22: 13101.83
A23: CO # 18 Fire monitoring system | B23: 3724
A24: CO # 19 Supply and install oven cabinet | B24: 2310 | C24: 1000 | E24: Terry Hinricher offsetting contribution
A25: CO # 20 Staircase wooden caps - EST | B25: 2000
A26: CO # 21 210 V outlet for ovens & eliminate gas lines - EST | B26: 1000
A28: Sub-Totals | B28: =SUM(B5:B26) -> 337160.05 | C28: =SUM(C5:C24) -> 3878.8
A30: Net Totals | B30: =B28-C28 -> 333281.25
A32: Possible additions:
A33: Safety cover for ladder to roof in 2nd floor rest room | B33: TBD
A34: Wiring for telephones | B34: 250
A35: Possible in-line heater for dishwasher - EST | B35: 500
A37: Final Total | B37: =SUM(B30:B36) -> 334031.25 | C37: =(B37-B5)/B5 -> 0.15519634615837521 | E37: Variance from original bid | F37: =B37-B5 -> 44875.86
A39: 39638
A40: Sanctuary
A41: Original Bid | B41: 202493.78
A42: CO # 1 Saw cuts/corrections | B42: 1764.68 | C42: 1764.68 | E42: Bollinger item - J&S mistake
A43: CO # 2 Security system pre-wire | B43: 922.9
A44: CO # 3 Plumbing design/build | B44: 490
A45: CO # 4 Credit for rest room counter tops | B45: -525
A46: CO # 5 Reimbursement for permits | B46: 947.23
A47: CO # 6 Security system installation | B47: 1870
A48: CO # 7 Relocate electrical panel, panel for theatrical lighting | B48: 2750 | E48: Bollinger item - J&S mistake
A49: CO # 8 New lighting changes (pendants) | B49: 4612.3
A50: CO # 9 Supply and install (4) Exit signs | B50: 1083.5 | C50: 500 | E50: Partial credit for external doors
A51: CO # 10 Concrete floor finish upgrade | B51: 3460.6
A52: CO # 11 AV conduit & junction boxes, outlets in hallway | B52: 6265.8
A53: CO # 12 Decorative tile in rest rooms | B53: 880
A54: CO # 13 Relocate electrical panel | B54: -1000
A55: CO # 14 Additional concrete floor dyes | B55: 3854.5
A56: CO # 15 Install theatrical lighting beams | B56: 2860
A57: Patio - Planters, deck, railings @ 50% | B57: 3875.5
A59: Sub-Totals | B59: =SUM(B41:B58) -> 236605.79 | C59: =SUM(C41:C57) -> 2264.68
A61: Net Totals | B61: =B59-C59 -> 234341.11
A63: Possible additions:
A64: Sub-contractor work, e.g. truss system | B64: 10050
A67: Total | B67: =SUM(B61:B64) -> 244391.11 | C67: =(B67-B41)/B41 -> 0.20690675041969184 | E67: Variance from original bid