A1: CVUUF Cost and Financing of Fellowship Building and Sanctuary
A2: As of July 9, 2008
A4: Costs to Close | E4: Sources of Funds to Close
A5: Shell Cost (1)
A6: Purchase Price for Building Shell | B6: 2572000 | E6: Capital Pledges Collected as of 9/1/07 (A) | F6: 1255383.11
A7: - Credit for Tenant Improvements | B7: -200340 | E7: UUA Match (B) | F7: 669673.4
A8: - Additional Credit for Tenant Improvements | B8: -4475 | E8: UUA New Home Grant (C) | F8: 25000
A9: = Net cost of Building Shell | B9: =SUM(B6:B8) -> 2367185 | E9: Mortgage | F9: 1100000
A11: Financing Fees (1) | E11: Total Available Funds to Close | F11: =SUM(F6:F10) -> 3050056.51
A12: Appraisal Fee | B12: 4000
A13: Prorations | B13: 761.56
A14: Loan Fees | B14: 4202.94 | E14: Directed Donations
A15: Loan Origination Fee (point) | B15: 11000 | E15: C. Smith Directed Donation for Sound System | F15: 1000
A16: Title/Escrow Charges | B16: 4390 | E16: Additional "non-building" capital fund raisers (H) | F16: 9040
A17: = Total Financing Fees | B17: =SUM(B12:B16) -> 24354.5 | E17: Total Directed Donations | F17: =SUM(F15:F16) -> 10040
A18: UUA Loan Guaranty Fee | B18: 900
A19: Total Cost Associated with Closing Shell | B19: =B9+B17+B18 -> 2392439.5
E20: Additional Capital Campaign Funds to be Collected
A21: Professional and Permit Fees | E21: Additional Capital Pledges paid by 6/1/09 | F21: 139950
A22: Fees to architects, lawyers, etc. (2) | B22: 39799 | E22: Less projected uncollectable (50%) (D) | F22: -69975
A23: W/W permit fees | B23: 13464 | E23: UUA Match (E) | F23: 0
A24: Other fees (3) | B24: 23892 | E24: PSWD Chalice Lighter's Home Grant (F) | F24: 14000
A25: = Total Professional and Permit Fees | B25: =SUM(B22:B24) -> 77155 | E25: Total Additional Collectible | F25: =SUM(F21:F24) -> 83975
A27: Build out of Fellowship Hall
A28: TI Build Out - Original Contract | B28: 289155.39 | E28: Maximum Identified Funds to Be Collected | F28: =F11+F17+F25 -> 3144071.51
A29: Cumulative Change Orders 1-21 (11) | B29: 44875.86 | E29: Potential Operating Cushion (G) | F29: =F28-B55 -> 240622.26
A30: = Total of Fellowship Hall Build out | B30: =SUM(B28:B29) -> 334031.25
A32: Furnishing Fellowship Hall
A33: RE Classroom Furnishings | B33: 7594
A34: Social Hall | B34: 5432
A35: Offices & Conference Room | B35: 5941
A36: Kitchen appliances & furnishings | B36: 17163
A37: = Total Fellowship Hall Furnishings | B37: =SUM(B33:B36) -> 36130
A39: Total Cost to Occupy Fellowship Hall | B39: =B19+B25+B30+B37 -> 2839755.75 | E39: Actual Cash Payments Toward 3/15/08 Closing (1)
E40: CVUUF
A41: CVUUF Sancuary Costs (7) | E41: Deposit with Bollinger 5/30/96 | F41: 257000
A42: Piano & music equipment | B42: 9122 | E42: Mortgage Deposit with FCB 8/22/07 | F42: 5000
A43: Staging & theatrical equipment | B43: 15062 | E43: CVUUF Payment 9/12/07 | F43: 433327
A44: Alter & liturgical furnishings | B44: 12865 | E44: Interest Earned on Escrow Account | F44: 16622.95
A45: Other furniture | B45: 1556 | E45: UUA Matching Grant 9/12/07 | F45: 669673.4
A46: Chairs | B46: 18263 | E46: Refund from Escrow | F46: -82086.69
E47: Total Payments on Behalf of CVUUF | F47: =SUM(F41:F46) -> 1299536.66
A48: Total CVUUF Sanctuary Costs | B48: =SUM(B42:B47) -> 56868
E49: 1st California Bank Mortgage | F49: 1100000
A50: Shared Sanctuary & Fellowship Hall Items
A51: Security System (5) | B51: 2950 | E51: Total Payments on Closing | F51: =F49+F47 -> 2399536.66
A52: Patio Upgrade (8) | B52: 3875.5
A53: Total CVUUF Shared Costs | B53: =SUM(B51:B52) -> 6825.5
A55: Total Capital Cost to Move into Site | B55: =(B39+B48+B53) -> 2903449.25 | E55: Color Coding Explanation
A56: Cost presented to Fellowship in June | B56: 2908000 | E56: Estimates; exact cost and funding still TBD
E57: Potential upside; showing most probable $
A66: Tenant Improvement Totals | E66: Board Limits For Site Committee Discretion (10)
A67: Total TI Build-out (including shared Sanctuary) | B67: =(B30+B53) -> 340856.75 | E67: TI Build Out | F67: 329495
A68: Total Furnishings (including Sanctuary) (9) | B68: =(B37+B48) -> 92998 | E68: Furnishings | F68: 93000
A70: Notes
A71: Costs
A72: (1) See Buyer's Final Settlement Statement, 4/1/08
A73: (2) Estimate - final bill from C. Packard not received
A74: (3) Includes SUP fees, storage, copying, misc. OTC costs
A76: (5) Additional estimated cost for change in door hardware to meet VCFD requirements - $5,900; equally shared with OCR Investors.
A77: (7) OCR Group to cover Sanctuary window coverings - $25K.
A78: (8) Equally shared with OCR Investors.
A79: (9) Includes $8,951 of contingency, which is not likely to be required in total.
A80: (10) If Totals exceed Board Limits for site committee discretion, Site committee must come back to Board for approval. Otherwise Site Committee may make necessary tradeoffs at their discretion.
A81: (11) Includes some estimates for staircase caps and 210 V line for ovens plus possible in-line water heater for DW
A83: Funding
A84: (A) Includes interest on investments
A85: (B) UUA match is based on gross funds collected prior to costs.
A86: (C) We received First Time Home Grant and funds were deposited.
A87: (D) $98,100 of uncollected pledges are for amounts over $5,000. This figure is probably conservative.
A88: (E) No additional matching grants will be made available.
A89: (F) Timing of collection TBD as well as exact amount.
A90: (G) Funds operating reserve for anticipated deficits. Exact cushion dependent on notes above.
A91: (H) Furnishing fundraiser to be conducted Nov - Dec 07. Estimate of likely receipts.